{
  "$schema": "https://json-schema.org/draft/2020-12/schema",
  "$id": "https://github.com/krmanik/chinese-immersion-library/schema/resource.schema.json",
  "title": "Chinese Immersion Library resource",
  "description": "One Chinese-language resource (website, channel, podcast or app). scripts/build.py enforces the same rules without dependencies.",
  "type": "object",
  "additionalProperties": false,
  "required": ["id", "name", "url", "description", "category", "type", "level", "script", "region", "language", "pricing"],
  "properties": {
    "id": {"type": "string", "pattern": "^[a-z0-9][a-z0-9-]{1,63}$", "description": "Stable unique id. Never change it once published; clients may store it."},
    "name": {"type": "string", "description": "Display name, usually Chinese + English."},
    "name_zh": {"type": "string"},
    "url": {"type": "string", "format": "uri", "description": "Where the user should be taken."},
    "description": {"type": "string", "maxLength": 300, "description": "One English sentence."},
    "category": {"type": "string", "description": "An id from categories.json."},
    "type": {"enum": ["website", "youtube", "bilibili", "podcast", "app", "newsletter"]},
    "tags": {"type": "array", "items": {"type": "string", "pattern": "^[a-z0-9][a-z0-9-]*$"}, "uniqueItems": true},
    "level": {"type": "array", "minItems": 1, "items": {"enum": ["beginner", "intermediate", "advanced"]}, "description": "Who can follow it. Native content is usually [\"advanced\"] or [\"intermediate\",\"advanced\"]."},
    "for_learners": {"type": "boolean", "description": "true when made specifically for learners of Chinese."},
    "script": {"enum": ["simplified", "traditional", "both"]},
    "region": {"enum": ["cn", "tw", "hk", "sg", "my", "global"]},
    "dialect": {"enum": ["mandarin", "cantonese"], "default": "mandarin"},
    "language": {"enum": ["zh", "zh+en", "en"], "description": "Language the content is presented in."},
    "pricing": {"enum": ["free", "freemium", "paid"]},
    "platforms": {"type": "array", "items": {"enum": ["web", "ios", "android"]}},
    "feed": {
      "type": "object",
      "additionalProperties": false,
      "required": ["format", "url"],
      "properties": {
        "format": {"enum": ["rss", "atom", "youtube", "podcast", "rsshub"], "description": "youtube = YouTube channel Atom feed; podcast = podcast RSS; rsshub = an RSSHub route (self-host for production)."},
        "url": {"type": "string", "format": "uri"}
      }
    },
    "ids": {
      "type": "object",
      "properties": {
        "youtube_channel_id": {"type": "string", "pattern": "^UC[\\w-]{22}$"},
        "apple_podcast_id": {"type": "string", "pattern": "^\\d+$"},
        "bilibili_mid": {"type": "string", "pattern": "^\\d+$"}
      }
    },
    "image": {"type": "string", "format": "uri", "description": "Avatar or artwork."},
    "notes": {"type": "string", "description": "Caveats, e.g. availability outside mainland China."}
  }
}
