[
  {
    "id": "hupu",
    "name": "虎扑 Hupu",
    "url": "https://www.hupu.com/",
    "description": "Sports community: NBA, football, esports.",
    "category": "sports",
    "type": "website",
    "tags": [
      "community"
    ],
    "level": [
      "intermediate",
      "advanced"
    ],
    "for_learners": false,
    "script": "simplified",
    "region": "cn",
    "dialect": "mandarin",
    "language": "zh",
    "pricing": "free",
    "platforms": [
      "web"
    ]
  },
  {
    "id": "dongqiudi",
    "name": "懂球帝 Dongqiudi",
    "url": "https://www.dongqiudi.com/",
    "description": "Football news, scores and a lively fan community.",
    "category": "sports",
    "type": "website",
    "tags": [
      "football"
    ],
    "level": [
      "intermediate",
      "advanced"
    ],
    "for_learners": false,
    "script": "simplified",
    "region": "cn",
    "dialect": "mandarin",
    "language": "zh",
    "pricing": "free",
    "platforms": [
      "web"
    ]
  },
  {
    "id": "sina-sports",
    "name": "新浪体育 Sina Sports",
    "url": "https://sports.sina.com.cn/",
    "description": "Sports news, scores and commentary from Sina.",
    "category": "sports",
    "type": "website",
    "tags": [
      "news"
    ],
    "level": [
      "intermediate",
      "advanced"
    ],
    "for_learners": false,
    "script": "simplified",
    "region": "cn",
    "dialect": "mandarin",
    "language": "zh",
    "pricing": "free",
    "platforms": [
      "web"
    ]
  },
  {
    "id": "tencent-sports",
    "name": "腾讯体育 Tencent Sports",
    "url": "https://sports.qq.com/",
    "description": "Sports news, highlights and live streams from Tencent.",
    "category": "sports",
    "type": "website",
    "tags": [
      "news"
    ],
    "level": [
      "intermediate",
      "advanced"
    ],
    "for_learners": false,
    "script": "simplified",
    "region": "cn",
    "dialect": "mandarin",
    "language": "zh",
    "pricing": "free",
    "platforms": [
      "web"
    ],
    "notes": "May load slowly or be unavailable outside mainland China."
  },
  {
    "id": "keep",
    "name": "Keep",
    "url": "https://www.gotokeep.com/",
    "description": "Chinese fitness app with guided workout videos.",
    "category": "sports",
    "type": "website",
    "tags": [
      "fitness"
    ],
    "level": [
      "intermediate",
      "advanced"
    ],
    "for_learners": false,
    "script": "simplified",
    "region": "cn",
    "dialect": "mandarin",
    "language": "zh",
    "pricing": "freemium",
    "platforms": [
      "ios",
      "android"
    ]
  },
  {
    "id": "cctv-sports",
    "name": "央视体育 CCTV Sports",
    "url": "https://sports.cctv.com/",
    "description": "CCTV-5 sports news, highlights and video.",
    "category": "sports",
    "type": "website",
    "tags": [
      "tv"
    ],
    "level": [
      "intermediate",
      "advanced"
    ],
    "for_learners": false,
    "script": "simplified",
    "region": "cn",
    "dialect": "mandarin",
    "language": "zh",
    "pricing": "free",
    "platforms": [
      "web"
    ]
  },
  {
    "id": "zhibo8",
    "name": "直播吧 Zhibo8",
    "url": "https://www.zhibo8.com/",
    "description": "Live scores, sports news and streams.",
    "category": "sports",
    "type": "website",
    "tags": [
      "live"
    ],
    "level": [
      "intermediate",
      "advanced"
    ],
    "for_learners": false,
    "script": "simplified",
    "region": "cn",
    "dialect": "mandarin",
    "language": "zh",
    "pricing": "free",
    "platforms": [
      "web"
    ]
  },
  {
    "id": "sportsv",
    "name": "运动视界 SportsV",
    "url": "https://www.sportsv.net/",
    "description": "Taiwanese sports commentary and analysis.",
    "category": "sports",
    "type": "website",
    "tags": [
      "analysis"
    ],
    "level": [
      "intermediate",
      "advanced"
    ],
    "for_learners": false,
    "script": "traditional",
    "region": "tw",
    "dialect": "mandarin",
    "language": "zh",
    "pricing": "free",
    "platforms": [
      "web"
    ]
  },
  {
    "id": "ettoday-website",
    "name": "ETtoday 運動雲",
    "url": "https://sports.ettoday.net/",
    "description": "Sports news from Taiwan's ETtoday.",
    "category": "sports",
    "type": "website",
    "tags": [
      "news"
    ],
    "level": [
      "intermediate",
      "advanced"
    ],
    "for_learners": false,
    "script": "traditional",
    "region": "tw",
    "dialect": "mandarin",
    "language": "zh",
    "pricing": "free",
    "platforms": [
      "web"
    ],
    "feed": {
      "format": "rss",
      "url": "https://feeds.feedburner.com/ettoday/sport"
    }
  },
  {
    "id": "boohee",
    "name": "薄荷健康 Boohee",
    "url": "https://www.boohee.com/",
    "description": "Diet and fitness tracking with food database.",
    "category": "sports",
    "type": "website",
    "tags": [
      "fitness",
      "nutrition"
    ],
    "level": [
      "intermediate",
      "advanced"
    ],
    "for_learners": false,
    "script": "simplified",
    "region": "cn",
    "dialect": "mandarin",
    "language": "zh",
    "pricing": "free",
    "platforms": [
      "web",
      "ios",
      "android"
    ]
  },
  {
    "id": "keep-youtube",
    "name": "Keep",
    "url": "https://www.youtube.com/@Keep-China",
    "description": "Keep fitness app's workout videos.",
    "category": "sports",
    "type": "youtube",
    "tags": [
      "fitness"
    ],
    "level": [
      "beginner",
      "intermediate"
    ],
    "for_learners": false,
    "script": "simplified",
    "region": "cn",
    "dialect": "mandarin",
    "language": "zh",
    "pricing": "free",
    "platforms": [
      "web",
      "ios",
      "android"
    ],
    "ids": {
      "youtube_channel_id": "UCa5z5-YvFEcWEe3jnn0L8sA"
    },
    "image": "https://yt3.googleusercontent.com/D9uVPTj8I-J0rn6QXzaF0x_noaCMDzWli287D_fzGCylNuSTFRPBYV_0Rj9JKVZ9QV-69dTfk20=s900-c-k-c0x00ffffff-no-rj",
    "feed": {
      "format": "youtube",
      "url": "https://www.youtube.com/feeds/videos.xml?channel_id=UCa5z5-YvFEcWEe3jnn0L8sA"
    }
  },
  {
    "id": "will-liu",
    "name": "劉畊宏 Will Liu",
    "url": "https://www.youtube.com/@willliu2989",
    "description": "Home workout livestream sensation.",
    "category": "sports",
    "type": "youtube",
    "tags": [
      "fitness"
    ],
    "level": [
      "beginner",
      "intermediate"
    ],
    "for_learners": false,
    "script": "traditional",
    "region": "tw",
    "dialect": "mandarin",
    "language": "zh",
    "pricing": "free",
    "platforms": [
      "web",
      "ios",
      "android"
    ],
    "ids": {
      "youtube_channel_id": "UCPikCyIJhEw1v1gDY6PlPMw"
    },
    "image": "https://yt3.googleusercontent.com/uxArIlUNPFRg2okk3j0cSRNRLFRUg-S2rwIXGBOnAyoxY5gOGV09Hd_XWAZNZQdDWvrDyo2HgQ=s900-c-k-c0x00ffffff-no-rj",
    "feed": {
      "format": "youtube",
      "url": "https://www.youtube.com/feeds/videos.xml?channel_id=UCPikCyIJhEw1v1gDY6PlPMw"
    }
  }
]
